{
  "$schema": "./house_grid.schema.json",
  "version": "1.0",
  "name": "Oakridge Elder Residence Blueprint",
  "description": "Sample residential grid blueprint with room zones, walls, and marked entrance/exit points.",
  "dimensions": {
    "rows": 8,
    "columns": 10,
    "cell_size_meters": 1.0
  },
  "entrances": [
    {
      "id": "entry_main",
      "name": "Front Entrance Door",
      "row": 7,
      "col": 4
    }
  ],
  "exits": [
    {
      "id": "exit_main",
      "name": "Front Entrance Door",
      "row": 7,
      "col": 4
    },
    {
      "id": "exit_garden",
      "name": "Backyard Garden Patio Exit",
      "row": 0,
      "col": 8
    }
  ],
  "named_zones": [
    {
      "id": "zone_living",
      "name": "Living Room",
      "color": "#3B82F6",
      "cells": [
        {"row": 3, "col": 1}, {"row": 3, "col": 2}, {"row": 3, "col": 3},
        {"row": 4, "col": 1}, {"row": 4, "col": 2}, {"row": 4, "col": 3},
        {"row": 5, "col": 1}, {"row": 5, "col": 2}, {"row": 5, "col": 3},
        {"row": 6, "col": 1}, {"row": 6, "col": 2}, {"row": 6, "col": 3}
      ]
    },
    {
      "id": "zone_kitchen",
      "name": "Kitchen",
      "color": "#10B981",
      "cells": [
        {"row": 0, "col": 1}, {"row": 0, "col": 2}, {"row": 0, "col": 3},
        {"row": 1, "col": 1}, {"row": 1, "col": 2}, {"row": 1, "col": 3},
        {"row": 2, "col": 1}, {"row": 2, "col": 2}, {"row": 2, "col": 3}
      ]
    },
    {
      "id": "zone_dining",
      "name": "Dining Area",
      "color": "#F59E0B",
      "cells": [
        {"row": 0, "col": 4}, {"row": 0, "col": 5},
        {"row": 1, "col": 4}, {"row": 1, "col": 5},
        {"row": 2, "col": 4}, {"row": 2, "col": 5}
      ]
    },
    {
      "id": "zone_hallway",
      "name": "Central Hallway",
      "color": "#6B7280",
      "cells": [
        {"row": 3, "col": 4}, {"row": 3, "col": 5},
        {"row": 4, "col": 4}, {"row": 4, "col": 5},
        {"row": 5, "col": 4}, {"row": 5, "col": 5},
        {"row": 6, "col": 4}, {"row": 6, "col": 5},
        {"row": 7, "col": 4}, {"row": 7, "col": 5}
      ]
    },
    {
      "id": "zone_master_bed",
      "name": "Master Bedroom",
      "color": "#8B5CF6",
      "cells": [
        {"row": 0, "col": 6}, {"row": 0, "col": 7},
        {"row": 1, "col": 6}, {"row": 1, "col": 7},
        {"row": 2, "col": 6}, {"row": 2, "col": 7},
        {"row": 3, "col": 6}, {"row": 3, "col": 7}
      ]
    },
    {
      "id": "zone_guest_bed",
      "name": "Guest Bedroom",
      "color": "#EC4899",
      "cells": [
        {"row": 5, "col": 7}, {"row": 5, "col": 8}, {"row": 5, "col": 9},
        {"row": 6, "col": 7}, {"row": 6, "col": 8}, {"row": 6, "col": 9},
        {"row": 7, "col": 7}, {"row": 7, "col": 8}, {"row": 7, "col": 9}
      ]
    },
    {
      "id": "zone_bathroom",
      "name": "En-suite Bathroom",
      "color": "#06B6D4",
      "cells": [
        {"row": 4, "col": 6}, {"row": 4, "col": 7},
        {"row": 5, "col": 6}
      ]
    },
    {
      "id": "zone_patio",
      "name": "Back Patio",
      "color": "#84CC16",
      "cells": [
        {"row": 0, "col": 8}, {"row": 0, "col": 9},
        {"row": 1, "col": 8}, {"row": 1, "col": 9}
      ]
    }
  ],
  "walls": [
    {"from": {"row": 0, "col": 0}, "to": {"row": 7, "col": 0}},
    {"from": {"row": 0, "col": 0}, "to": {"row": 0, "col": 9}},
    {"from": {"row": 7, "col": 0}, "to": {"row": 7, "col": 9}},
    {"from": {"row": 0, "col": 9}, "to": {"row": 7, "col": 9}},
    {"from": {"row": 3, "col": 1}, "to": {"row": 3, "col": 4}},
    {"from": {"row": 0, "col": 6}, "to": {"row": 4, "col": 6}},
    {"from": {"row": 4, "col": 6}, "to": {"row": 4, "col": 8}}
  ]
}
